{
 "aggregates": [
  {
   "coverage": 8,
   "geomean_max_rss_vs_c": 1.0,
   "geomean_vs_c": 1.0,
   "language": "c",
   "memory_coverage": 8,
   "mode": "cold",
   "size": "s",
   "tag": "all",
   "variant": "default"
  },
  {
   "coverage": 2,
   "geomean_max_rss_vs_c": 1.0,
   "geomean_vs_c": 1.0,
   "language": "c",
   "memory_coverage": 2,
   "mode": "cold",
   "size": "s",
   "tag": "alloc",
   "variant": "default"
  },
  {
   "coverage": 5,
   "geomean_max_rss_vs_c": 1.0,
   "geomean_vs_c": 1.0,
   "language": "c",
   "memory_coverage": 5,
   "mode": "cold",
   "size": "s",
   "tag": "array-index",
   "variant": "default"
  },
  {
   "coverage": 2,
   "geomean_max_rss_vs_c": 1.0,
   "geomean_vs_c": 1.0,
   "language": "c",
   "memory_coverage": 2,
   "mode": "cold",
   "size": "s",
   "tag": "call",
   "variant": "default"
  },
  {
   "coverage": 4,
   "geomean_max_rss_vs_c": 1.0,
   "geomean_vs_c": 1.0,
   "language": "c",
   "memory_coverage": 4,
   "mode": "cold",
   "size": "s",
   "tag": "float",
   "variant": "default"
  },
  {
   "coverage": 2,
   "geomean_max_rss_vs_c": 1.0,
   "geomean_vs_c": 1.0,
   "language": "c",
   "memory_coverage": 2,
   "mode": "cold",
   "size": "s",
   "tag": "int",
   "variant": "default"
  },
  {
   "coverage": 6,
   "geomean_max_rss_vs_c": 1.0,
   "geomean_vs_c": 1.0,
   "language": "c",
   "memory_coverage": 6,
   "mode": "cold",
   "size": "s",
   "tag": "loop",
   "variant": "default"
  },
  {
   "coverage": 1,
   "geomean_max_rss_vs_c": 1.0,
   "geomean_vs_c": 1.0,
   "language": "c",
   "memory_coverage": 1,
   "mode": "cold",
   "size": "s",
   "tag": "map",
   "variant": "default"
  },
  {
   "coverage": 1,
   "geomean_max_rss_vs_c": 1.0,
   "geomean_vs_c": 1.0,
   "language": "c",
   "memory_coverage": 1,
   "mode": "cold",
   "size": "s",
   "tag": "rc",
   "variant": "default"
  },
  {
   "coverage": 1,
   "geomean_max_rss_vs_c": 1.0,
   "geomean_vs_c": 1.0,
   "language": "c",
   "memory_coverage": 1,
   "mode": "cold",
   "size": "s",
   "tag": "sort",
   "variant": "default"
  },
  {
   "coverage": 1,
   "geomean_max_rss_vs_c": 1.0,
   "geomean_vs_c": 1.0,
   "language": "c",
   "memory_coverage": 1,
   "mode": "cold",
   "size": "s",
   "tag": "string",
   "variant": "default"
  },
  {
   "coverage": 1,
   "geomean_max_rss_vs_c": 1.0,
   "geomean_vs_c": 1.0,
   "language": "c",
   "memory_coverage": 1,
   "mode": "cold",
   "size": "s",
   "tag": "struct-field",
   "variant": "default"
  },
  {
   "coverage": 8,
   "geomean_vs_c": 1.0,
   "language": "c",
   "mode": "hot",
   "size": "s",
   "tag": "all",
   "variant": "default"
  },
  {
   "coverage": 2,
   "geomean_vs_c": 1.0,
   "language": "c",
   "mode": "hot",
   "size": "s",
   "tag": "alloc",
   "variant": "default"
  },
  {
   "coverage": 5,
   "geomean_vs_c": 1.0,
   "language": "c",
   "mode": "hot",
   "size": "s",
   "tag": "array-index",
   "variant": "default"
  },
  {
   "coverage": 2,
   "geomean_vs_c": 1.0,
   "language": "c",
   "mode": "hot",
   "size": "s",
   "tag": "call",
   "variant": "default"
  },
  {
   "coverage": 4,
   "geomean_vs_c": 1.0,
   "language": "c",
   "mode": "hot",
   "size": "s",
   "tag": "float",
   "variant": "default"
  },
  {
   "coverage": 2,
   "geomean_vs_c": 1.0,
   "language": "c",
   "mode": "hot",
   "size": "s",
   "tag": "int",
   "variant": "default"
  },
  {
   "coverage": 6,
   "geomean_vs_c": 1.0,
   "language": "c",
   "mode": "hot",
   "size": "s",
   "tag": "loop",
   "variant": "default"
  },
  {
   "coverage": 1,
   "geomean_vs_c": 1.0,
   "language": "c",
   "mode": "hot",
   "size": "s",
   "tag": "map",
   "variant": "default"
  },
  {
   "coverage": 1,
   "geomean_vs_c": 1.0,
   "language": "c",
   "mode": "hot",
   "size": "s",
   "tag": "rc",
   "variant": "default"
  },
  {
   "coverage": 1,
   "geomean_vs_c": 1.0,
   "language": "c",
   "mode": "hot",
   "size": "s",
   "tag": "sort",
   "variant": "default"
  },
  {
   "coverage": 1,
   "geomean_vs_c": 1.0,
   "language": "c",
   "mode": "hot",
   "size": "s",
   "tag": "string",
   "variant": "default"
  },
  {
   "coverage": 1,
   "geomean_vs_c": 1.0,
   "language": "c",
   "mode": "hot",
   "size": "s",
   "tag": "struct-field",
   "variant": "default"
  },
  {
   "coverage": 8,
   "geomean_max_rss_vs_c": 1.0204701933030582,
   "geomean_vs_c": 1.983121594765156,
   "language": "miri",
   "memory_coverage": 8,
   "mode": "cold",
   "size": "s",
   "tag": "all",
   "variant": "default"
  },
  {
   "coverage": 2,
   "geomean_max_rss_vs_c": 1.084429432083845,
   "geomean_vs_c": 2.5169113390692903,
   "language": "miri",
   "memory_coverage": 2,
   "mode": "cold",
   "size": "s",
   "tag": "alloc",
   "variant": "default"
  },
  {
   "coverage": 5,
   "geomean_max_rss_vs_c": 1.0,
   "geomean_vs_c": 2.048118793623594,
   "language": "miri",
   "memory_coverage": 5,
   "mode": "cold",
   "size": "s",
   "tag": "array-index",
   "variant": "default"
  },
  {
   "coverage": 2,
   "geomean_max_rss_vs_c": 1.0,
   "geomean_vs_c": 1.6402786355376755,
   "language": "miri",
   "memory_coverage": 2,
   "mode": "cold",
   "size": "s",
   "tag": "call",
   "variant": "default"
  },
  {
   "coverage": 4,
   "geomean_max_rss_vs_c": 1.0,
   "geomean_vs_c": 1.7656018006572807,
   "language": "miri",
   "memory_coverage": 4,
   "mode": "cold",
   "size": "s",
   "tag": "float",
   "variant": "default"
  },
  {
   "coverage": 2,
   "geomean_max_rss_vs_c": 1.0,
   "geomean_vs_c": 1.9712600994840859,
   "language": "miri",
   "memory_coverage": 2,
   "mode": "cold",
   "size": "s",
   "tag": "int",
   "variant": "default"
  },
  {
   "coverage": 6,
   "geomean_max_rss_vs_c": 1.0,
   "geomean_vs_c": 1.831652792907523,
   "language": "miri",
   "memory_coverage": 6,
   "mode": "cold",
   "size": "s",
   "tag": "loop",
   "variant": "default"
  },
  {
   "coverage": 1,
   "geomean_max_rss_vs_c": 1.1759871931696906,
   "geomean_vs_c": 5.357368031123571,
   "language": "miri",
   "memory_coverage": 1,
   "mode": "cold",
   "size": "s",
   "tag": "map",
   "variant": "default"
  },
  {
   "coverage": 1,
   "geomean_max_rss_vs_c": 1.0,
   "geomean_vs_c": 1.1824542670828975,
   "language": "miri",
   "memory_coverage": 1,
   "mode": "cold",
   "size": "s",
   "tag": "rc",
   "variant": "default"
  },
  {
   "coverage": 1,
   "geomean_max_rss_vs_c": 1.1759871931696906,
   "geomean_vs_c": 5.357368031123571,
   "language": "miri",
   "memory_coverage": 1,
   "mode": "cold",
   "size": "s",
   "tag": "sort",
   "variant": "default"
  },
  {
   "coverage": 1,
   "geomean_max_rss_vs_c": 1.1759871931696906,
   "geomean_vs_c": 5.357368031123571,
   "language": "miri",
   "memory_coverage": 1,
   "mode": "cold",
   "size": "s",
   "tag": "string",
   "variant": "default"
  },
  {
   "coverage": 1,
   "geomean_max_rss_vs_c": 1.0,
   "geomean_vs_c": 1.762730649228607,
   "language": "miri",
   "memory_coverage": 1,
   "mode": "cold",
   "size": "s",
   "tag": "struct-field",
   "variant": "default"
  },
  {
   "coverage": 8,
   "geomean_vs_c": 2.0614719691435055,
   "language": "miri",
   "mode": "hot",
   "size": "s",
   "tag": "all",
   "variant": "default"
  },
  {
   "coverage": 2,
   "geomean_vs_c": 2.5020008341301683,
   "language": "miri",
   "mode": "hot",
   "size": "s",
   "tag": "alloc",
   "variant": "default"
  },
  {
   "coverage": 5,
   "geomean_vs_c": 2.1862206342556103,
   "language": "miri",
   "mode": "hot",
   "size": "s",
   "tag": "array-index",
   "variant": "default"
  },
  {
   "coverage": 2,
   "geomean_vs_c": 1.6428922157384402,
   "language": "miri",
   "mode": "hot",
   "size": "s",
   "tag": "call",
   "variant": "default"
  },
  {
   "coverage": 4,
   "geomean_vs_c": 1.833273615375365,
   "language": "miri",
   "mode": "hot",
   "size": "s",
   "tag": "float",
   "variant": "default"
  },
  {
   "coverage": 2,
   "geomean_vs_c": 2.1476707835564475,
   "language": "miri",
   "mode": "hot",
   "size": "s",
   "tag": "int",
   "variant": "default"
  },
  {
   "coverage": 6,
   "geomean_vs_c": 1.9325946002371515,
   "language": "miri",
   "mode": "hot",
   "size": "s",
   "tag": "loop",
   "variant": "default"
  },
  {
   "coverage": 1,
   "geomean_vs_c": 5.873105837971792,
   "language": "miri",
   "mode": "hot",
   "size": "s",
   "tag": "map",
   "variant": "default"
  },
  {
   "coverage": 1,
   "geomean_vs_c": 1.0658769561949317,
   "language": "miri",
   "mode": "hot",
   "size": "s",
   "tag": "rc",
   "variant": "default"
  },
  {
   "coverage": 1,
   "geomean_vs_c": 5.873105837971792,
   "language": "miri",
   "mode": "hot",
   "size": "s",
   "tag": "sort",
   "variant": "default"
  },
  {
   "coverage": 1,
   "geomean_vs_c": 5.873105837971792,
   "language": "miri",
   "mode": "hot",
   "size": "s",
   "tag": "string",
   "variant": "default"
  },
  {
   "coverage": 1,
   "geomean_vs_c": 1.8157281939684367,
   "language": "miri",
   "mode": "hot",
   "size": "s",
   "tag": "struct-field",
   "variant": "default"
  },
  {
   "coverage": 8,
   "geomean_max_rss_vs_c": 1.0,
   "geomean_vs_c": 1.115121810446843,
   "language": "rust",
   "memory_coverage": 8,
   "mode": "cold",
   "size": "s",
   "tag": "all",
   "variant": "default"
  },
  {
   "coverage": 2,
   "geomean_max_rss_vs_c": 1.0,
   "geomean_vs_c": 1.2078151446761785,
   "language": "rust",
   "memory_coverage": 2,
   "mode": "cold",
   "size": "s",
   "tag": "alloc",
   "variant": "default"
  },
  {
   "coverage": 5,
   "geomean_max_rss_vs_c": 1.0,
   "geomean_vs_c": 1.1090652451620662,
   "language": "rust",
   "memory_coverage": 5,
   "mode": "cold",
   "size": "s",
   "tag": "array-index",
   "variant": "default"
  },
  {
   "coverage": 2,
   "geomean_max_rss_vs_c": 1.0,
   "geomean_vs_c": 0.9882910806301887,
   "language": "rust",
   "memory_coverage": 2,
   "mode": "cold",
   "size": "s",
   "tag": "call",
   "variant": "default"
  },
  {
   "coverage": 4,
   "geomean_max_rss_vs_c": 1.0,